{
  "formatVersion": 1,
  "catalogId": "effect-workflow-builder-bpmn-2.0.2",
  "catalogRevision": 5,
  "standard": {
    "name": "Business Process Model and Notation",
    "version": "2.0.2",
    "authority": "Object Management Group",
    "specificationUrl": "https://www.omg.org/spec/BPMN/2.0.2"
  },
  "normativeCoverageComplete": false,
  "requirements": [
    {
      "id": "BPMN-FOUNDATION-SEMANTIC-MODEL",
      "title": "Versioned BPMN semantic model foundation",
      "facet": "semantic-model",
      "source": {
        "authority": "OMG",
        "document": "Business Process Model and Notation 2.0.2",
        "section": "8-13",
        "url": "https://www.omg.org/spec/BPMN/2.0.2"
      },
      "dependsOn": [],
      "notes": "A semantic IR is necessary but does not by itself satisfy a modeling conformance subclass."
    },
    {
      "id": "BPMN-FOUNDATION-SEMANTIC-VALIDATION",
      "title": "BPMN semantic reference and context validation foundation",
      "facet": "validation",
      "source": {
        "authority": "OMG",
        "document": "Business Process Model and Notation 2.0.2",
        "section": "8-13",
        "url": "https://www.omg.org/spec/BPMN/2.0.2"
      },
      "dependsOn": [
        "BPMN-FOUNDATION-SEMANTIC-MODEL"
      ]
    },
    {
      "id": "BPMN-FOUNDATION-DURABLE-MARKING",
      "title": "Durable token and scope state foundation",
      "facet": "execution-state",
      "source": {
        "authority": "OMG",
        "document": "Business Process Model and Notation 2.0.2",
        "section": "13",
        "url": "https://www.omg.org/spec/BPMN/2.0.2"
      },
      "dependsOn": [
        "BPMN-FOUNDATION-SEMANTIC-MODEL",
        "BPMN-FOUNDATION-SEMANTIC-VALIDATION"
      ],
      "notes": "A state schema is not evidence that normative transitions are implemented."
    },
    {
      "id": "BPMN-FOUNDATION-EVIDENCE-GATES",
      "title": "Machine-readable conformance evidence gates",
      "facet": "validation",
      "source": {
        "authority": "OMG",
        "document": "Business Process Model and Notation 2.0.2",
        "section": "2.1",
        "url": "https://www.omg.org/spec/BPMN/2.0.2"
      },
      "dependsOn": []
    },
    {
      "id": "BPMN-EXECUTION-BASIC-TOKEN-KERNEL",
      "title": "Executable token transitions for an explicitly admitted BPMN subset",
      "facet": "execution",
      "source": {
        "authority": "OMG",
        "document": "Business Process Model and Notation 2.0.2",
        "section": "13",
        "url": "https://www.omg.org/spec/BPMN/2.0.2"
      },
      "dependsOn": [
        "BPMN-FOUNDATION-DURABLE-MARKING"
      ]
    },
    {
      "id": "BPMN-EXECUTION-CORE-PROCESS-XML-SLICE",
      "title": "Executable intersection of the named core-process XML profile and token kernel",
      "facet": "execution",
      "source": {
        "authority": "OMG",
        "document": "Business Process Model and Notation 2.0.2",
        "section": "10 and 13",
        "url": "https://www.omg.org/spec/BPMN/2.0.2"
      },
      "dependsOn": [
        "BPMN-EXECUTION-BASIC-TOKEN-KERNEL",
        "BPMN-INTERCHANGE-CORE-PROCESS-XML-SLICE"
      ],
      "notes": "This is a deliberately narrower executable admission profile, not Process Execution Conformance. It rejects rather than infers unsupported process, gateway, event, activity, and implicit-activation semantics."
    },
    {
      "id": "BPMN-INTERCHANGE-BOUNDED-XML-INFOSET",
      "title": "Bounded namespace-aware XML infoset parsing and serialization",
      "facet": "xml-interchange",
      "source": {
        "authority": "OMG",
        "document": "BPMN20.xsd and Semantic.xsd",
        "url": "https://www.omg.org/spec/BPMN/2.0.2"
      },
      "dependsOn": []
    },
    {
      "id": "BPMN-INTERCHANGE-CORE-PROCESS-XML-SLICE",
      "title": "Strict named BPMN core-process XML mapping slice",
      "facet": "xml-interchange",
      "source": {
        "authority": "OMG",
        "document": "BPMN20.xsd and Semantic.xsd",
        "section": "tDefinitions, tProcess, flow nodes, and tSequenceFlow",
        "url": "https://www.omg.org/spec/BPMN/2.0.2"
      },
      "dependsOn": [
        "BPMN-FOUNDATION-SEMANTIC-MODEL",
        "BPMN-FOUNDATION-SEMANTIC-VALIDATION",
        "BPMN-INTERCHANGE-BOUNDED-XML-INFOSET"
      ],
      "notes": "Profile bpmn-2.0.2-core-process-di-v2 covers ordinary processes and recursive subprocesses, generic tasks, source-level callActivity callable-element QNames, none start/end events, exclusive/parallel gateways, sequence flows, conditions, defaults, definitions metadata, and explicit expression-version bindings. Call activities are interchange-only until immutable child-target resolution and durable parent/child execution exist. This is a fail-closed implementation slice, not an OMG conformance subclass or complete semantic mapping."
    },
    {
      "id": "BPMN-INTERCHANGE-SEMANTIC-MAPPING",
      "title": "Loss-aware mapping between BPMN XML and the semantic model",
      "facet": "xml-interchange",
      "source": {
        "authority": "OMG",
        "document": "BPMN20.xsd and Semantic.xsd",
        "url": "https://www.omg.org/spec/BPMN/2.0.2"
      },
      "dependsOn": [
        "BPMN-FOUNDATION-SEMANTIC-MODEL",
        "BPMN-INTERCHANGE-BOUNDED-XML-INFOSET"
      ]
    },
    {
      "id": "BPMN-INTERCHANGE-NORMATIVE-XSD",
      "title": "Validation against the normative BPMN 2.0.2 XSD set",
      "facet": "xml-interchange",
      "source": {
        "authority": "OMG",
        "document": "BPMN20.xsd, Semantic.xsd, BPMNDI.xsd, DI.xsd, and DC.xsd",
        "url": "https://www.omg.org/spec/BPMN/2.0.2"
      },
      "dependsOn": [
        "BPMN-INTERCHANGE-SEMANTIC-MAPPING"
      ]
    },
    {
      "id": "BPMN-DI-SEMANTIC-MODEL",
      "title": "BPMN Diagram Interchange semantic model",
      "facet": "diagram-interchange",
      "source": {
        "authority": "OMG",
        "document": "BPMNDI.xsd, DI.xsd, and DC.xsd",
        "url": "https://www.omg.org/spec/BPMN/2.0.2"
      },
      "dependsOn": [
        "BPMN-FOUNDATION-SEMANTIC-MODEL"
      ]
    },
    {
      "id": "BPMN-DI-CORE-XML-SLICE",
      "title": "Strict named BPMN Diagram Interchange XML mapping slice",
      "facet": "diagram-interchange",
      "source": {
        "authority": "OMG",
        "document": "BPMNDI.xsd, DI.xsd, and DC.xsd",
        "url": "https://www.omg.org/spec/BPMN/2.0.2"
      },
      "dependsOn": [
        "BPMN-DI-SEMANTIC-MODEL",
        "BPMN-INTERCHANGE-CORE-PROCESS-XML-SLICE"
      ],
      "notes": "Profile bpmn-2.0.2-core-process-di-v2 maps the package's complete current normalized DI slice with global XML-ID and semantic reference-kind checks. It is not the complete BPMN DI interchange surface and has no normative XSD evidence yet."
    },
    {
      "id": "BPMN-DI-XML-ROUNDTRIP",
      "title": "BPMN Diagram Interchange XML import and export",
      "facet": "diagram-interchange",
      "source": {
        "authority": "OMG",
        "document": "BPMNDI.xsd, DI.xsd, and DC.xsd",
        "url": "https://www.omg.org/spec/BPMN/2.0.2"
      },
      "dependsOn": [
        "BPMN-DI-SEMANTIC-MODEL",
        "BPMN-INTERCHANGE-SEMANTIC-MAPPING",
        "BPMN-INTERCHANGE-NORMATIVE-XSD"
      ]
    },
    {
      "id": "BPMN-DATA-IO-INTERFACE-SLICE",
      "title": "Normalized BPMN data, IO specification, and callable interface slice",
      "facet": "semantic-model",
      "source": {
        "authority": "OMG",
        "document": "Business Process Model and Notation 2.0.2",
        "section": "10.3.6-10.4",
        "url": "https://www.omg.org/spec/BPMN/2.0.2"
      },
      "dependsOn": [
        "BPMN-FOUNDATION-SEMANTIC-MODEL"
      ],
      "notes": "This bounded normalized slice does not cover Event payload IO, imported CallableElements or external Operation bindings, task-kind-specific mappings, complete CallActivity IO equality, or expression-language typing."
    },
    {
      "id": "BPMN-COMMON-EXECUTABLE-METAMODEL",
      "title": "Complete Common Executable process metamodel surface",
      "facet": "semantic-model",
      "source": {
        "authority": "OMG",
        "document": "Business Process Model and Notation 2.0.2",
        "section": "2.2.1",
        "url": "https://www.omg.org/spec/BPMN/2.0.2"
      },
      "dependsOn": [
        "BPMN-FOUNDATION-SEMANTIC-MODEL"
      ],
      "notes": "Includes the applicable data, resource, correlation, interface, lane, artifact, and root-element surfaces."
    },
    {
      "id": "BPMN-EXECUTION-ACTIVITY-LIFECYCLE",
      "title": "Normative Activity lifecycle and operational semantics",
      "facet": "execution",
      "source": {
        "authority": "OMG",
        "document": "Business Process Model and Notation 2.0.2",
        "section": "13",
        "url": "https://www.omg.org/spec/BPMN/2.0.2"
      },
      "dependsOn": [
        "BPMN-COMMON-EXECUTABLE-METAMODEL",
        "BPMN-EXECUTION-BASIC-TOKEN-KERNEL"
      ]
    },
    {
      "id": "WFP-CONTROL-FLOW-CATALOG",
      "title": "Control-flow pattern catalogue",
      "facet": "validation",
      "source": {
        "authority": "WorkflowPatterns",
        "document": "Workflow Patterns: The Definitive Guide",
        "section": "Chapter 4",
        "pages": "105-188"
      },
      "dependsOn": [],
      "notes": "Family requirement only. Atomic control-flow requirements are being admitted separately; prose coverage is not implementation evidence."
    },
    {
      "id": "WFP-WCP01-SEQUENCE",
      "title": "WCP1 Sequence",
      "facet": "execution",
      "source": {
        "authority": "WorkflowPatterns",
        "document": "Workflow Patterns: The Definitive Guide",
        "section": "4.6",
        "pages": "167-168"
      },
      "dependsOn": [
        "WFP-CONTROL-FLOW-CATALOG",
        "BPMN-EXECUTION-BASIC-TOKEN-KERNEL"
      ]
    },
    {
      "id": "WFP-WCP02-PARALLEL-SPLIT",